[
  {
    "id": "sm-root",
    "prefLabel": "Tax subject matter",
    "altLabel": [],
    "definition": null,
    "facet": "subject_matter",
    "broader": null,
    "broader_all": [],
    "narrower": [
      "sm-income",
      "sm-capital",
      "sm-gst-hst",
      "sm-registered-plans",
      "sm-charities",
      "sm-incentives",
      "sm-business-accounting",
      "sm-credits-deductions",
      "sm-structural"
    ],
    "related": [],
    "mapped_provisions": [],
    "glossary_terms": [],
    "method": "skeleton",
    "validated": false
  },
  {
    "id": "sm-income",
    "prefLabel": "Income & its computation",
    "altLabel": [],
    "definition": null,
    "facet": "subject_matter",
    "broader": "sm-root",
    "broader_all": [
      "sm-root"
    ],
    "narrower": [],
    "related": [],
    "mapped_provisions": [
      "9",
      "20(1)(a)",
      "Reg 1100",
      "13(21)",
      "5",
      "6",
      "3",
      "2(2)"
    ],
    "glossary_terms": [
      "business-income",
      "capital-cost-allowance-cca",
      "depreciable-property",
      "employment-income",
      "net-income",
      "taxable-income"
    ],
    "method": "skeleton",
    "validated": false
  },
  {
    "id": "sm-capital",
    "prefLabel": "Capital gains & property",
    "altLabel": [
      "ACB",
      "CCA"
    ],
    "definition": null,
    "facet": "subject_matter",
    "broader": "sm-root",
    "broader_all": [
      "sm-root"
    ],
    "narrower": [],
    "related": [],
    "mapped_provisions": [
      "54",
      "20(1)(a)",
      "Reg 1100",
      "39(1)(a)",
      "40",
      "39(1)(b)",
      "13(21)",
      "248(1)",
      "40(2)(b)",
      "40(2)(g)",
      "38(a)"
    ],
    "glossary_terms": [
      "adjusted-cost-base-acb",
      "capital-cost-allowance-cca",
      "capital-gain",
      "capital-loss",
      "capital-property",
      "depreciable-property",
      "disposition",
      "principal-residence",
      "proceeds-of-disposition",
      "superficial-loss",
      "taxable-capital-gain"
    ],
    "method": "skeleton",
    "validated": false
  },
  {
    "id": "sm-gst-hst",
    "prefLabel": "GST/HST",
    "altLabel": [
      "ITC"
    ],
    "definition": null,
    "facet": "subject_matter",
    "broader": "sm-root",
    "broader_all": [
      "sm-root"
    ],
    "narrower": [],
    "related": [],
    "mapped_provisions": [
      "ETA 123(1)",
      "ETA Sch V",
      "122.5",
      "ETA 240",
      "ETA 169",
      "ETA 225",
      "ETA 228",
      "ETA 144.1",
      "ETA 148",
      "ETA Sch VI"
    ],
    "glossary_terms": [
      "commercial-activity",
      "consideration",
      "exempt-supply",
      "gst-hst-credit",
      "gst-hst-registrant",
      "input-tax-credit-itc",
      "net-tax",
      "participating-province",
      "place-of-supply",
      "small-supplier",
      "supply",
      "taxable-supply",
      "zero-rated-supply"
    ],
    "method": "skeleton",
    "validated": false
  },
  {
    "id": "sm-registered-plans",
    "prefLabel": "Registered & savings plans",
    "altLabel": [
      "EAP",
      "FHSA",
      "HBP",
      "LLP",
      "RESP",
      "RPP",
      "RRIF",
      "RRSP",
      "TFSA"
    ],
    "definition": null,
    "facet": "subject_matter",
    "broader": "sm-root",
    "broader_all": [
      "sm-root"
    ],
    "narrower": [],
    "related": [],
    "mapped_provisions": [
      "146.1(1)",
      "146.6",
      "146.6(1)",
      "146.01",
      "146.02",
      "146.1",
      "147.1",
      "146.3",
      "146",
      "146.2"
    ],
    "glossary_terms": [
      "educational-assistance-payment-eap",
      "first-home-savings-account-fhsa",
      "fhsa-participation-room",
      "home-buyers-plan-hbp",
      "lifelong-learning-plan-llp",
      "qualified-investment",
      "registered-education-savings-plan-resp",
      "registered-pension-plan-rpp",
      "registered-retirement-income-fund-rrif",
      "registered-retirement-savings-plan-rrsp",
      "subscriber",
      "tax-free-savings-account-tfsa"
    ],
    "method": "skeleton",
    "validated": false
  },
  {
    "id": "sm-charities",
    "prefLabel": "Charities & donations",
    "altLabel": [],
    "definition": null,
    "facet": "subject_matter",
    "broader": "sm-root",
    "broader_all": [
      "sm-root"
    ],
    "narrower": [],
    "related": [],
    "mapped_provisions": [
      "118.1",
      "237.1",
      "Reg 3501",
      "149.1(1)",
      "248(1)",
      "149.1"
    ],
    "glossary_terms": [
      "gift",
      "gifting-arrangement",
      "official-donation-receipt",
      "qualified-donee",
      "registered-charity"
    ],
    "method": "skeleton",
    "validated": false
  },
  {
    "id": "sm-incentives",
    "prefLabel": "Tax incentives & shelters",
    "altLabel": [
      "FTS",
      "ITC",
      "SR&ED"
    ],
    "definition": null,
    "facet": "subject_matter",
    "broader": "sm-root",
    "broader_all": [
      "sm-root"
    ],
    "narrower": [],
    "related": [],
    "mapped_provisions": [
      "66(15)",
      "237.1",
      "127(5)",
      "127(9)",
      "237.1(1)",
      "37",
      "248(1)"
    ],
    "glossary_terms": [
      "flow-through-share-fts",
      "gifting-arrangement",
      "investment-tax-credit-itc",
      "prescribed-property",
      "promoter",
      "scientific-research-and-experimental-development-sr-ed",
      "tax-shelter",
      "tax-shelter-identification-number"
    ],
    "method": "skeleton",
    "validated": false
  },
  {
    "id": "sm-business-accounting",
    "prefLabel": "Business & accounting concepts",
    "altLabel": [],
    "definition": null,
    "facet": "subject_matter",
    "broader": "sm-root",
    "broader_all": [
      "sm-root"
    ],
    "narrower": [],
    "related": [],
    "mapped_provisions": [
      "9",
      "248(1)",
      "249.1",
      "10",
      "96",
      "102",
      "153"
    ],
    "glossary_terms": [
      "account",
      "accounts-payable",
      "accounts-receivable",
      "business-income",
      "corporation",
      "expense",
      "fiscal-period",
      "inventory",
      "partnership",
      "payroll-remittance",
      "revenue"
    ],
    "method": "skeleton",
    "validated": false
  },
  {
    "id": "sm-credits-deductions",
    "prefLabel": "Credits, deductions & benefits",
    "altLabel": [],
    "definition": null,
    "facet": "subject_matter",
    "broader": "sm-root",
    "broader_all": [
      "sm-root"
    ],
    "narrower": [],
    "related": [],
    "mapped_provisions": [
      "122.5",
      "118(1)"
    ],
    "glossary_terms": [
      "benefit",
      "deduction",
      "eligible-child",
      "gst-hst-credit",
      "spouse-or-common-law-partner-amount",
      "tax-credit",
      "tax-deduction"
    ],
    "method": "skeleton",
    "validated": false
  },
  {
    "id": "sm-structural",
    "prefLabel": "Structural & general legal concepts",
    "altLabel": [],
    "definition": null,
    "facet": "subject_matter",
    "broader": "sm-root",
    "broader_all": [
      "sm-root"
    ],
    "narrower": [],
    "related": [],
    "mapped_provisions": [
      "248(1)"
    ],
    "glossary_terms": [
      "common-law-partner",
      "property"
    ],
    "method": "skeleton",
    "validated": false
  },
  {
    "id": "ps-root",
    "prefLabel": "Compliance lifecycle",
    "altLabel": [],
    "definition": null,
    "facet": "process_stage",
    "broader": null,
    "broader_all": [],
    "narrower": [
      "ps-filing",
      "ps-assessment",
      "ps-payment-collection",
      "ps-audit",
      "ps-appeals",
      "ps-sred-review"
    ],
    "related": [],
    "mapped_provisions": [],
    "glossary_terms": [],
    "method": "skeleton",
    "validated": false
  },
  {
    "id": "ps-filing",
    "prefLabel": "Filing & registration",
    "altLabel": [],
    "definition": null,
    "facet": "process_stage",
    "broader": "ps-root",
    "broader_all": [
      "ps-root"
    ],
    "narrower": [],
    "related": [],
    "mapped_provisions": [
      "150"
    ],
    "glossary_terms": [
      "income-tax-return",
      "return"
    ],
    "method": "skeleton",
    "validated": false
  },
  {
    "id": "ps-assessment",
    "prefLabel": "Assessment & reassessment",
    "altLabel": [
      "NOA"
    ],
    "definition": null,
    "facet": "process_stage",
    "broader": "ps-root",
    "broader_all": [
      "ps-root"
    ],
    "narrower": [],
    "related": [],
    "mapped_provisions": [
      "152",
      "152(4)"
    ],
    "glossary_terms": [
      "notice-of-assessment-noa",
      "reassessment"
    ],
    "method": "skeleton",
    "validated": false
  },
  {
    "id": "ps-payment-collection",
    "prefLabel": "Payment, refund & collection",
    "altLabel": [],
    "definition": null,
    "facet": "process_stage",
    "broader": "ps-root",
    "broader_all": [
      "ps-root"
    ],
    "narrower": [],
    "related": [],
    "mapped_provisions": [
      "153",
      "164"
    ],
    "glossary_terms": [
      "balance-owing",
      "payroll-remittance",
      "refund",
      "remittance"
    ],
    "method": "skeleton",
    "validated": false
  },
  {
    "id": "ps-audit",
    "prefLabel": "Audit & examination",
    "altLabel": [
      "DID",
      "ECA",
      "QAS",
      "AAF",
      "QA",
      "RFI",
      "UN",
      "BBR",
      "TEBA-NPV",
      "TPRO-NPV",
      "IAD",
      "CPRS",
      "SOD",
      "QR"
    ],
    "definition": null,
    "facet": "process_stage",
    "broader": "ps-root",
    "broader_all": [
      "ps-root"
    ],
    "narrower": [],
    "related": [],
    "mapped_provisions": [],
    "glossary_terms": [
      "did",
      "eca",
      "qas",
      "aaf",
      "qa",
      "rfi",
      "un",
      "bbr",
      "teba-npv",
      "tpro-npv",
      "iad",
      "cprs",
      "sod",
      "qr"
    ],
    "method": "skeleton",
    "validated": false
  },
  {
    "id": "ps-appeals",
    "prefLabel": "Objections & appeals",
    "altLabel": [
      "NOO"
    ],